{
  "artifact_type": "PR_CI_RESULT",
  "result_version": 3,
  "owner": "TOOL",
  "repository_id": "example/repo",
  "pr_number": 42,
  "base_sha": "03d691ce70c8703e6e719e1063c01040f405894f",
  "head_sha": "f8a5f006b48461efacd6573638d0ee74af1bcd53",
  "pr_body_digest": "221e3dceaa575133af775b62442768fef6621e42c477c337362834f90a3c59e7",
  "pr_record_digest": "8edf2b8928a07a0be71e43756327b87c19d31c08d4ff8097724177702dbe7f69",
  "brain_block_digest": "8eb750a9619827ee948b40d2f4e107ffe2b62bd22a2cd62d44ed7609ed50bc1a",
  "codex_block_digest": "bb2ac21bf33d62f727822537b249e25d29361debbde7b2dc2fa0a7174d16adcd",
  "projection_digest": "8e67cc6387cae209a5579bf8fe2e94832fdbb35ec9e35648dbe39917ffe17fb6",
  "codex_return_digest": "9d53f28f01509a8d0d384cc851bf4e1acf47a7eef371c3a193c75ba22ac84724",
  "evidence_bundle_digest": "873da4b0e36030626636ea5b7589cd62a5a3e3ee9b907b2bbd880c3e9de47bca",
  "brain_review_capsule_digest": "9d6006d72053faef13172b5e7be4d4cb1f521e93d6fb02fe59913c35512b75a9",
  "actual_changed_paths_digest": "f6285b352b9be07000f0df292da4ec0221ee0a724431877c5f9b517af0d1ce03",
  "checks": [
    {
      "check_id": "CURRENT_REPOSITORY_IDENTITY",
      "status": "PASS",
      "evidence": "example/repo"
    },
    {
      "check_id": "BASE_IS_ANCESTOR_OF_HEAD",
      "status": "PASS",
      "evidence": "03d691ce70c8703e6e719e1063c01040f405894f..f8a5f006b48461efacd6573638d0ee74af1bcd53"
    },
    {
      "check_id": "CURRENT_DIFF_EQUALS_CODEX_RETURN",
      "status": "PASS",
      "evidence": "f6285b352b9be07000f0df292da4ec0221ee0a724431877c5f9b517af0d1ce03"
    },
    {
      "check_id": "CURRENT_SEALED_SOURCE_CHAIN",
      "status": "PASS",
      "evidence": "9d6006d72053faef13172b5e7be4d4cb1f521e93d6fb02fe59913c35512b75a9"
    }
  ],
  "result": "PASS",
  "raw_output_ref": "test:joyflow-pr-ci:stdout",
  "source_state_before_digest": "f3cf4ec0f235b5ae8f90d3f87981ea6ef67e2dc7fb6ae9e845dac06de4d7f4e1",
  "source_state_after_digest": "f3cf4ec0f235b5ae8f90d3f87981ea6ef67e2dc7fb6ae9e845dac06de4d7f4e1",
  "result_digest": "8079765a27520542b1f6c95bee45ea4343668affa15d78d483f1178452678d8d"
}
